TSE,MUNICIPIO,UF,BAIRRO/LOCALIDADE,ÍNDICE DE VIRA VOTO,VALIDOS,Lula,Bolsonaro,Tebet,Ciro,"NEM LULA, NEM BOLSONARO",ANTI-BOLSONARO
7013,AFONSO CUNHA,MA,CENTRO - ZONA URBANA,0.766,3420,0.847,0.125,0.007,0.019,0.027,0.874
7013,AFONSO CUNHA,MA,POVOADO SAO FRANCISCO DO BRAGA- ZONA RURAL,0.722,320,0.869,0.075,0.003,0.05,0.056,0.925
7013,AFONSO CUNHA,MA,POVOADO OLHO DAGUA- ZONA RURAL,0.674,517,0.969,0.023,0.0,0.008,0.008,0.977
7013,AFONSO CUNHA,MA,POVOADO BOA ESPERANÇA- ZONA RURAL,0.639,266,0.966,0.019,0.0,0.008,0.016,0.982
7013,AFONSO CUNHA,MA,POVOADO LOLOIA- ZONA RURAL,0.636,434,0.887,0.094,0.005,0.014,0.019,0.906
7013,AFONSO CUNHA,MA,POVOADO CAPOEIRAS- ZONA RURAL,0.63,309,0.929,0.061,0.0,0.01,0.01,0.939
