TSE,MUNICIPIO,UF,BAIRRO/LOCALIDADE,ÍNDICE DE VIRA VOTO,VALIDOS,Lula,Bolsonaro,Tebet,Ciro,"NEM LULA, NEM BOLSONARO",ANTI-BOLSONARO
91812,PEDRA PRETA,MT,VILA SÃO SEBASTIÃO,0.595,1088,0.54,0.392,0.028,0.017,0.067,0.607
91812,PEDRA PRETA,MT,CENTRO,0.543,6390,0.402,0.539,0.034,0.013,0.058,0.46
91812,PEDRA PRETA,MT,ASSENTAMENTO MONTE AZUL (ZONA RURAL),0.536,174,0.575,0.351,0.034,0.017,0.074,0.649
91812,PEDRA PRETA,MT,NÚCLEO HABITACIONAL JOÃO DE BARRO,0.492,602,0.566,0.389,0.022,0.013,0.046,0.612
91812,PEDRA PRETA,MT,COHAB VALE DO JURIGUE I,0.437,1255,0.412,0.534,0.033,0.01,0.056,0.468
91812,PEDRA PRETA,MT,LOTEAMENTO VILA GARÇA BRANCA (ZONA RURAL),0.329,648,0.424,0.539,0.02,0.009,0.037,0.461
91812,PEDRA PRETA,MT,DISTRITO SÃO JOSÉ DO PLANALTO (ZONA RURAL),0.156,179,0.291,0.665,0.034,0.0,0.045,0.336
